{
  "id": "atoms3r_ext_proto",
  "name": "AtomS3R-Ext Proto terminals (logical order)",
  "layout": {
    "rows": 19,
    "cols": 1,
    "pitch_mm": null,
    "numbering": "custom",
    "key": "none",
    "view": "component_side"
  },
  "positions": [
    {
      "id": "1",
      "row": 0,
      "col": 0
    },
    {
      "id": "2",
      "row": 1,
      "col": 0
    },
    {
      "id": "3",
      "row": 2,
      "col": 0
    },
    {
      "id": "4",
      "row": 3,
      "col": 0
    },
    {
      "id": "5",
      "row": 4,
      "col": 0
    },
    {
      "id": "6",
      "row": 5,
      "col": 0
    },
    {
      "id": "7",
      "row": 6,
      "col": 0
    },
    {
      "id": "8",
      "row": 7,
      "col": 0
    },
    {
      "id": "9",
      "row": 8,
      "col": 0
    },
    {
      "id": "10",
      "row": 9,
      "col": 0
    },
    {
      "id": "11",
      "row": 10,
      "col": 0
    },
    {
      "id": "12",
      "row": 11,
      "col": 0
    },
    {
      "id": "13",
      "row": 12,
      "col": 0
    },
    {
      "id": "14",
      "row": 13,
      "col": 0
    },
    {
      "id": "15",
      "row": 14,
      "col": 0
    },
    {
      "id": "16",
      "row": 15,
      "col": 0
    },
    {
      "id": "17",
      "row": 16,
      "col": 0
    },
    {
      "id": "18",
      "row": 17,
      "col": 0
    },
    {
      "id": "19",
      "row": 18,
      "col": 0
    }
  ],
  "rails": [
    "1v2",
    "2v8"
  ],
  "note": "Numbers follow the official Proto Pin table. The single column is a logical ordering; physical terminal placement and pitch are unverified. It does not describe the unconnected 5x6 prototyping area.",
  "verified": {
    "layout": null
  }
}
